I Want Them Alive!," When Saruman sends the Uruk-Hai out to battle, he tells the leader that ""one of the halflings [hobbits] carries something of great importance"" so he wants them alive ""and unspoiled"" (meaning, don't even search them for valuables). Luckily for Merry and Pippin, the Uruk leader doesn't know he has the wrong hobbits.",,,,,,,,
Jump Scare," Gandalf knows something's wrong with the Ring that he had to pressure Bilbo into finally discarding, but he isn't entirely sure just what it's capable of as he reaches for it. The instant his fingers grace its metal, a hellish eye of fire appears with a screaming sound and a boom more akin to primordial thunder not even a quarter of a second. It's no wonder the next scene cuts to him watching the nearby fireplace in a stupor to separate his mind from the horror he witnessed and not even realizing Frodo has entered for half a minute.",,,,,,,,
Keystone Army," In the Action Prologue , when Isildur desperately slices off the fingers of Sauron's ring-hand, all of Sauron's troops fall dead in an instant.",,,,,,,,
Kill It with Fire," Strider uses this method to drive off the Nazgûl at Weathertop, with a Throwing Your Torch Always Works finisher.",,,,,,,,
Kill the Lights," When Gandalf intimidates Bilbo to convince him to leave the Ring behind, the room darkens and his voice gains a menacing reverberation. He also seems to grow, though he may simply be standing up from a slouch. Gandalf: Bilbo Baggins, do not take me for some conjurer of cheap tricks! A similar effect happens during the Council of Elrond when Gandalf breaks up the squabble by reciting the ring couplet in Black Speech , though as this scene is outside, the darkening is less noticeable.",,,,,,,,
Black Speech,"ct happens during the Council of Elrond when Gandalf breaks up the squabble by reciting the ring couplet in Black Speech , though as this scene is outside, the darkening is less noticeable.",,,,,,,,
Killed Offscreen," The Hobbit who has a run-in with the Ringwraiths on the road. We see the lead wraith swing his sword, and the Hobbit's surprised face, but then it cuts back to Frodo and Gandalf talking in a Discretion Shot .",,,,,,,,
Kubrick Stare," Foreshadowed when Isildur (in flashback) gave Elrond exactly the same stare, in exactly the same circumstances. One of the powers of the One Ring is to cause Kubrick Stares.",,,,,,,,
Lancer vs. Dragon," Though Aragorn isn't the main hero and Lurtz isn't the main villain, their intense fight is the climax of the film.",,,,,,,,
Last Breath Bullet," Just when the Gandalf and the Fellowship believe that the Balrog is falling to its doom, it goes and pulls a Last Breath Whip and drags Gandalf along with it.",,,,,,,,
Last Day of Normalcy," Bilbo's birthday party introduces us to all the characters of Hobbiton prior to their being thrust into their adventure, from gentle and thoughtful Frodo to loyal and simple Samwise, to the mischievous pair of Merry and Pippin (their role changed somewhat from the books, where they were more savvy to Bilbo's magic ring). This is a downplayed example, though, as while it does serve the purpose of showing the tranquility of Hobbiton, it isn't until Gandalf returns with confirmation of the nature of Bilbo's ring that Frodo is thrust out the door on an adventure.",,,,,,,,
Last Kiss, Aragorn gave a dying Boromir a kiss on the forehead as part of a blessing.,,,,,,,,
Legend Fades to Myth," According to Galadriel's prologue, this is why things came to be as they were at the end of the Third Age: people forgot about past threats, and grew complacent. Sauron exploited that.",,,,,,,,
Let Us Never Speak of This Again," Subverted. After Gandalf says that Sauron must never find the Ring, Frodo says they'll put it away and never speak of it again... except that Sauron has already found Gollum, who also knew that Bilbo had the Ring, knows of the Shire, and has sent the Nazgûl to claim it.",,,,,,,,
Light Is Good, Arwen appears to Frodo in a flowing white gown with light radiating out from her. This is just a vision to Frodo but it symbolizes that she is good and is there to help him. Though she does warn him that she could end up evil and remain like she is .,,,,,,,,
Literal Cliffhanger, Gandalf clings to the broken edge of the Bridge of Khazad-Dûm before falling to his temporary death.,,,,,,,,
Literal Disarming," Aragorn does this to Lurtz, followed by stabbing him through the chest and finally decapitating him . Lurtz didn't die until that last one.",,,,,,,,
"Little ""No"""," Isildur gave one to Elrond during the Siege of Barad-dûr following his defeat of Sauron after Elrond demands that he destroy the Ring. In the present-day, Elrond tells Gandalf that it was this moment that caused him to lose his faith in Men.",,,,,,,,
Locked Out of the Loop," In contrast to the book (and despite Gandalf’s urgings), Frodo is not made privy to Bilbo's plans for his disappearing act during his 111st Birthday, or that he’s leaving the Shire. Downplayed with Gimli and Frodo's Mithril Coat (and one that was there in the original release, but which has since been retroactively confirmed by The Hobbit Film Trilogy ). Despite being the son of one of the members of the late Thorin Oakenshield’s Company, Gimli doesn’t know that Bilbo was gifted the Mithril Coat for his services during the Quest of Erebor; he only finds out when Gandalf mentions it during their trek through Moria. Either Glóin didn't know (which, given Bilbo was wearing it around Erebor, seems unlikely), or Glóin simply didn’t tell his son. Either way, the revelation's quite a surprise for Gimli. Related to the above example, nobody in the Fellowship is initially aware that Frodo brought Bilbo's Mithril Coat (let alone that he's wearing it); they don't find out until the clash in the Chamber of Mazarbul. That said, it’s hinted Gandalf suspects when he's discussing Mithril earlier (and notice he's also not that surprised when Frodo ""miraculously"" survives the cave troll’s spear thrust). Even before they hit Moria, it surely didn't escape Gandalf's notice that Bilbo bequeathed the Ring and Sting to his nephew, yet the third and final tool the old Hobbit had acquired during the Quest of Erebor was conspicuously absent.",,,,,,,,
The Hobbit Film Trilogy," Frodo's Mithril Coat (and one that was there in the original release, but which has since been retroactively confirmed by The Hobbit Film Trilogy ). Despite being the son of one of the members of the late Thorin Oakenshield’s Company, Gimli doesn’t know that Bilbo was gifted the Mithril Coat for his services during the Quest of Erebor; he only finds out when Gandalf mentions it during their trek through Moria. Either Glóin didn't know (which, given Bilbo was wearing it around Erebor, seems unlikely), or Glóin simply didn’t tell his son. Either way, the revelation's quite a surprise for Gimli.",,,,,,,,
Lodged-Blade Recycling," Aragorn impales the cave troll with a spear; the troll pulls it out and uses it to eventually stab Frodo, who only survives because of his mithril shirt. Lurtz pulls Aragorn's knife out and throws it back at him — but only after licking it .",,,,,,,,
licking it,Aragorn's knife out and throws it back at him — but only after licking it .,,,,,,,,
Manly Tears," Boromir 's Final Speech : Boromir : I would have gone with you to the end, my brother... my captain... my king. Galadriel's intense gaze reduces Boromir to tears, most likely because he knows that she knows that he will eventually betray the Fellowship.",,,,,,,,
Final Speech,"al Speech : Boromir : I would have gone with you to the end, my brother... my captain... my king.",,,,,,,,
Made of Incendium," The Ringwraiths will burst into flames if they come in contact with a fire source. Aragorn uses this to an incredibly effective degree when he lights up half of them and hurls the torch so hard that it embeds into one's face. Doesn't really seem to deter them for long, though.",,,,,,,,
Major Injury Underreaction," Boromir merely grunts, drops to his knees, then gets right back up and keeps fighting after being shot with an arrow. It's not until the third that he stays down, and even then he's more concerned about failing the Fellowship than the fact that he has three arrows sticking out of his chest. Bear in mind that the shafts of these arrows were themselves a full inch in diameter.",,,,,,,,
Man Hug," Frodo and Sam share a big, tearful hug after Sam risks drowning to accompany Frodo to Mordor.",,,,,,,,
Meaningful Background Event, You see the giant eagle behind Saruman right before Gandalf jumps from the tower of Orthanc.,,,,,,,,
Meaningful Echo," The tune from ""Concerning Hobbits"" (the piece that plays as the Shire is introduced) appears at the end of the movie in "" The Breaking of the Fellowship "".",,,,,,,,
Million Mook March," The army of the Last Alliance, as a flashback.",,,,,,,,
Miracle Food, Elven lembas bread (which got more emphasis in the original book) is featured in a scene from the Extended Edition DVD. Legolas explains to the hobbits Merry and Pippin that a single bite of lembas can fill a grown man's stomach for a day. As soon as Legolas leaves: Merry: How many did you eat? Pippin: Four. [groans],,,,,,,,
Mordor," The fearsome trope namer is described by Boromir with the following words: ""One does not simply walk into Mordor. Its black gates are guarded by more than just orcs. There is evil there that does not sleep, and the Great Eye is ever watchful. It is a barren wasteland, riddled with fire, ash, and dust. The very air you breathe is a poisonous fume. Not with ten thousand men could you do this. It is folly.""",,,,,,,,
Murder Water," The flash flood that Arwen summons to wash away the Nazgûl pursuing Frodo and the Ring is represented by a herd of watery horses charing down the river and sweeping the Nazgûl away, in a rare heroic version of this trope.",,,,,,,,
My New Gift Is Lame," Each member in the Fellowship receives cool personal gifts from Galadriel, including a magical lantern for Frodo, some daggers for Pippin and Merry, and a coveted lock of golden hair for Gimli. Sam, however, gets some rope. Visibly underwhelmed, he even has the balls to ask if he might have a ""shiny dagger"" as well, but Galadriel just smirks at his impudence and doesn't bother to reply. Of course, the rope magically unties itself when necessary, and comes in very useful . In the book, Sam is given a rare seed and fertile soil from Lothlórien due to his trade as a gardener. The rope is just part of the general equipment.",,,,,,,,
Mythology Gag, The scene angle when the Nazgûl are looking for the Hobbits hiding in a root is directly taken from the Ralph Bakshi animated version .,,,,,,,,
Myth Prologue," The film opens with the story of how the rings of power were forged (effectively introducing the races of Middle Earth in the process), how Sauron used the One Ring of Power to take over Middle Earth, how Isildur failed to destroy the ring once Sauron was defeated, and how millennia would pass before it was fished out of the water once again. Galadriel, narrating, mourns that there are so few still alive who were there to witness it. This is a deviation from the book, which opened on Bilbo's birthday in the Shire, and makes the mythic scope of the film more immediately obvious to audiences.",,,,,,,,
"""Nations of the World"" Montage", The shots of all of the free peoples of Middle-earth showing up for the Council of Elrond.,,,,,,,,
Natural Spotlight," A few scenes, like Balin's tomb which was described like this even in the original novel, explained by ingenious light channels carved by the dwarves in the mountainside. On the other hand, the one lighting Gollum's cave in the prologue comes off as highly improbable, considering its depth and the fact that Gollum can't stand daylight.",,,,,,,,
Never Found the Body," Gandalf's fall. He actually dies though, but not because of the fall, and, as he is a Maia (angelic spirit), he is brought Back from the Dead by his employers anyway.",,,,,,,,
Nightmare Face, When Bilbo wants to take a look at the One Ring. Holy crap !,,,,,,,,
"Nice Job Breaking It, Hero!"," Bilbo sharing his name and place of origin with Gollum during the Riddle Game back in The Hobbit: An Unexpected Journey (and while it was there in 2001, it was more of an implication; it's clearer now with the Middle-earth films completed). This comment, given without thought and in passing 60 years earlier, finally comes back to bite the Baggins Family with a vengeance. Gollum is located and captured by Sauron's forces (and before Gandalf can get to him first) and tortured into divulging what he knows. This gives the Nazgûl their first real lead on the One Ring's whereabouts since Sauron's original downfall. And since Bilbo has left the Shire at this point, Frodo's left holding the bag (and the Ring) and forced to go on the run. Pippin's curiosity leading him to mess with a skeleton by a well in Moria, leading to the whole thing, chains and bucket and all, toppling in. Not only does this lead to them being attacked by a horde of goblins, it awakens the Balrog, and ultimately results in Gandalf's death.",,,,,,,,
The Hobbit: An Unexpected Journey," origin with Gollum during the Riddle Game back in The Hobbit: An Unexpected Journey (and while it was there in 2001, it was more of an implication; it's clearer now with the Middle-earth films completed). This comment, given without thought and in passing 60 years earlier, finally comes back to bite the Baggins Family with a vengeance. Gollum is located and captured by Sauron's forces (and before Gandalf can get to him first) and tortured into divulging what he knows. This gives the Nazgûl their first real lead on the One Ring's whereabouts since Sauron's original downfall. And since Bilbo has left the Shire at this point, Frodo's left holding the bag (and the Ring) and forced to go on the run.",,,,,,,,
No Escape but Down, When the hobbits are chased by a farmer and his dogs.,,,,,,,,
Noisy Nature," Judging by their extremely cacophonic cries, Saruman's scary flock of avian spies are evidently Starlings (yes, they've invaded New Zealand too).",,,,,,,,
Noodle Incident," The ""incident with the dragon"" is this to anyone who hasn't read the books.",,,,,,,,
Not-So-Omniscient Council of Bickering," The Council of Elrond dissolves into a lot of vicious arguing, causing Frodo to make his heroic choice.",,,,,,,,
O.O.C. Is Serious Business, A plot point. Bilbo’s uncharacteristic outburst and behavior when he leaves Bag End and initially refuses to relinquish the Ring alarms Gandalf. It’s what finally brings Gandalf's longstanding concerns to a head (along with his brief contact with Sauron’s presence) and prompts his fact-finding mission to Minas Tirith’s archives.,,,,,,,,
Offscreen Teleportation," Gandalf manages to move from Bilbo's party to Bag End before Bilbo himself gets there, even though he is seen sitting in the audience while Bilbo is running home, made invisible by the Ring. All without crossing paths with him, either. He is a wizard, but not even the most powerful beings in Middle-earth can manage actual teleportation.",,,,,,,,
Off with His Head!," One of the Ringwraiths cuts a hapless Hobbit's head off when they're riding into the Shire, although it happens offscreen . Aragorn decapitates an Orc in Moria, with a big spurt of Black Blood right before the Cave Troll shows up. Aragorn finishes Lurtz off by cutting off his head.",,,,,,,,
happens,"e Ringwraiths cuts a hapless Hobbit's head off when they're riding into the Shire, although it happens offscreen .",,,,,,,,
Black Blood,"itates an Orc in Moria, with a big spurt of Black Blood right before the Cave Troll shows up.",,,,,,,,
"Oh, Crap!"," The film features many examples. A great one in the prologue battle when Sauron makes his appearance on the battlefield. These mighty Dúnedain have just mopped the floor with the Orcs and are about to declare their victory... then all of a sudden a black-armoured giant with a very big mace strides into their midst... Frodo in the first film, when he realizes that the two words Sauron's forces got from Gollum (Shire and Baggins) means that they know where the One Ring is and are coming to take it. Gandalf when Saruman informs him that now in knowledge of the One Ring's location, Sauron has dispatched some of his most lethal agents to get it back. Saruman: Sauron's forces are already moving. The Nine have left Minas Morgul. Gandalf: [horrified] The Nine ?! Also Gandalf's reaction when Saruman reveals he is in league with Sauron and bars the former's escape from Orthanc. During the Skirmish at Weathertop, Frodo hears Sauron's voice emanating from the Ring and is tempted to pull it out of his pocket. He immediately panics as he realizes he just confirmed to Sauron's forces that he has the Ring on him. note Remember, at that point the Nazgûl had no idea which of the four halflings they were pursuing out of Bree bore the name ""Baggins"" and whether they had taken the Ring with them or hidden it somewhere. When Arwen summons a tidal wave to beat the Nazgûl. Granted, they don't have faces, but their behaviour is enough to convey it. In Moria: Gandalf's reaction to hear Goblin drums beating, as the denizens of Moria have realised there are intruders in their home. Boromir's deadpan "" They have a cave troll ."" Spoken in an almost Graham Chapman voice. Legolas gets a pretty good Oh Crap look when he realizes there's a Balrog down there. The Moria Goblins are also similarly terrified. Elrond has an Oh Crap reaction to the fact that Saruman is breeding an Orc army of his own. An army that can move in sunlight. Aragorn and Legolas are busy fighting the Uruk-Hai on Amon Hen, when suddenly they hear the Horn of Gondor being blown frantically. ""Boromir!!!""",,,,,,,,
The Nine,"en Saruman informs him that now in knowledge of the One Ring's location, Sauron has dispatched some of his most lethal agents to get it back. Saruman: Sauron's forces are already moving. The Nine have left Minas Morgul. Gandalf: [horrified] The Nine ?!",,,,,,,,
They have a cave troll,"tion to hear Goblin drums beating, as the denizens of Moria have realised there are intruders in their home. Boromir's deadpan "" They have a cave troll ."" Spoken in an almost Graham Chapman voice. Legolas gets a pretty good Oh Crap look when he realizes there's a Balrog down there. The Moria Goblins are also similarly terrified.",,,,,,,,
They have a cave troll," have a cave troll ."" Spoken in an almost Graham Chapman voice.",,,,,,,,
An army that can move in sunlight.,e fact that Saruman is breeding an Orc army of his own. An army that can move in sunlight.,,,,,,,,
Onrushing Army, The prologue of the film features mindlessly rushing Orcs against more disciplined Elves.,,,,,,,,
Opening Monologue," Galadriel's now iconic opening monologue of the film, describing the forging of the Rings Of Power , the Battle of the Last Alliance, Sauron's downfall and the One Ring being lost and forgotten, basically laying the groundwork for the beginning of the main story. The page quote at the top is just part of it. She speaks some Elvish (Sindarin) at the beginning of the monologue. ""( I amar prestar aen. ) The world is changed. ( Han matho ne nen. ) I feel it in the water. ( Han mathon ned cae. ) I feel it in the earth. ( A han noston ned gwilith. ) I smell it in the air. Much that once was is lost, for none now live who remember it.""",,,,,,,,
Open Sesame," When the Fellowship tries to enter Moria through the enchanted gate that's inscribed ""Speak friend and enter"". Which actually TELLS you what to say.",,,,,,,,
Parrying Bullets," Aragorn performs an era-appropriate variation when he uses his sword to swat aside a knife flying towards his head. Impressively, there's no CGI involved in the stunt; Viggo Mortensen actually parried a knife accidentally thrown at his face by the other actor.",,,,,,,,
Patrick Stewart Speech," Boromir's speech to Aragorn, shortly before the Breaking of the Fellowship. Though not a straight subversion of this trope, the story demonstrates a few scenes later that the reality of human nature is uglier than Boromir's speech makes it out to be .",,,,,,,,
Phosphor-Essence, Galadriel glows with a bluish-white light when she explains how powerful and terrible she would become were she to accept the Ring.,,,,,,,,
Plummet Perspective, A torch is dropped by Boromir on the way to the Bridge of Khazad-dûm; he barely saves himself from following it.,,,,,,,,
Poor Communication Kills," Zigzagged when Gandalf realizes Gollum's followed them into Moria. He doesn't inform anyone else in the Fellowship for 3 days (likely because, given what else was down in Moria, an insane former Ringbearer was the least of their problems). If Frodo hadn’t spotted Gollum by chance and reported it, the Fellowship would’ve remained unaware they were being trailed (since Gandalf would have taken that knowledge with him when he falls into the chasm ). But because Frodo sounded the alarm, Aragorn’s now vigilant in the Extended Editon (and hoped they’d lose Gollum on the Anduin River). Frodo and Sam are also likewise now on their guard after they split off at the end of this film and this vigilance allows them to capture Gollum at the beginning of the next film .",,,,,,,,
Portal Statue Pairs," The Argonath, also known as the Gate of Kings or the Pillars of the Kings, was a landmark on the northern edge of Gondor in representing two of the earliest kings of Gondor.",,,,,,,,
Power Echoes," Gandalf's voice gets deep and echoes when he declares: "" BILBO BAGGINS — DO NOT TAKE ME FOR SOME CONJUROR OF CHEAP TRICKS!! I AM NOT TRYING TO ROB YOU! "" Also: "" YOU... SHALL NOT... PASS!!! ''"" Heard when Saruman is chanting the spell to ""bring down the mountain"" on the Fellowship in the Pass of Caradhras.",,,,,,,,
Power Glows," When Galadriel enters her wraith-like form, she emits a powerful white glow.",,,,,,,,
Pragmatic Adaptation, The removal of Tom Bombadil.,,,,,,,,
Pragmatic Villainy," Implied with Gollum when he’s following the Fellowship in Moria, then makes it out of the Mines and stays on their tail down the Anduin in the Extended Edition. Despite having Frodo in his sight, Gollum makes no move to reclaim his Precious in this film. The subtext is that even Gollum knows that trying to take the Ring from Frodo while he’s surrounded and protected by armed bodyguards is a bad idea. Gollum won’t make his play for the Ring until The Two Two Towers after Frodo is separated from the Fellowship at Amon Hen.",,,,,,,,
The Precarious Ledge," The Fellowships must traverse a narrow ledge at The Pass of Caradhras through the snow, even as Saruman tries to bring them down with his foul chanting.",,,,,,,,
Precision F-Strike," Implied when Gimli gets irritated with Haldir speaking Elvish with Aragorn and feeling left out of the convesation. Gimli shoots off an insult in Elvish, and whatever he said leaves Haldir fuming and Aragorn both embarrassed and pissed that the Dwarf is making his already-delicate negotiations even more difficult.",,,,,,,,
Pre-Explosion Glow," In the prologue, when his finger gets cut off, Sauron starts glowing from the inside before blowing up.",,,,,,,,
Prophecy Twist," Played with in the extended version. When Aragorn tells Frodo about the Story of Lúthien, who gave up her immortality to live a mortal life with the man she loved, Frodo asks him how it turned out. To which Aragorn simply replies ""She died.""",,,,,,,,
Punch! Punch! Punch! Uh Oh...," Hobbits attacking a cave troll should have this effect, but the scene is hardly played for laughs.",,,,,,,,
Punctuality Is for Peasants," When Gandalf the Grey meets up with Frodo Baggins on the way to attend the birthday party being thrown for Frodo's uncle Bilbo Baggins, Frodo accuses the wizard of being late, to which Gandalf retorts that he arrived when he planned to. Subverted and Played for Laughs , as Gandalf, who is a close friend of the Baggins, actually arrived just as the party was being set up, and both Frodo and Gandalf quickly break into laughter at the quip. Frodo: You're late! Gandalf: A wizard is never late, Frodo Baggins. Nor is he early, he arrives precisely when he means to!",,,,,,,,
Punctuated!  For!  Emphasis!," ""You! Shall Not! Pass!"" . Then the bridge practically broke in half.",,,,,,,,
Pull Yourself Down the Spear," When Aragorn stabs Lurtz in the stomach, the Uruk-hai responds by pulling the sword inwards, snarling at Aragorn, possibly to get close enough to hurt him. Aragorn pulls the sword out and chops off Lurtz's head .",,,,,,,,
Radial Ass Kicking," The Balrog chases them off before the fight actually happens but in the Mines of Moria, the Fellowship finds itself completely surrounded by a really absurd number of goblins.",,,,,,,,
Rain of Arrows," The prologue sequence shows the Battle of Dagorlad, where the combined armies of the Elves and Númenóreans rain arrows down on the orcs of Mordor before Sauron himself takes to the field.",,,,,,,,
Rasputinian Death," Even after being shot with 3 arrows, Boromir puts up a fight before dying.",,,,,,,,
Reality Has No Subtitles," Depending on the circumstances, non-Common dialogue may or may not be subtitled. A notable example is Elrond shouting orders to his troops at the battle on Mount Doom.",,,,,,,,
Redemption Equals Death," Boromir's famous death scene happened right after he attacked Frodo, tried to take the ring from him, and cursed him along with ""all the halflings"". What was he doing during his death scene? Defending two of these ""Halflings"" with his life.",,,,,,,,
Red Filter of Doom," The filter is red owing to a fiery demon, the Balrog.",,,,,,,,
