Defeat Equals Explosion," Sauron explodes with the force of a tactical nuke after Isildur cuts the ring from his hand in the prologue of the movie, flooring basically everyone across the battlefield with the shockwave.",,,,,,,,
Deliberate Injury Gambit," In a villainous version, the Uruk-Hai leader is impaled on Aragorn's sword, and pulls himself up the blade to get up in his face and snarl. Aragorn promptly yanks the sword back out and lops off his head.",,,,,,,,
Delicious Distraction," During the extended version opening of the movie (well, second opening; during the Concerning Hobbits scene), a hobbit-maid is about to kiss her hobbit-lover, who is distracted by a basket of muffins going around and eats it instead. At the exact same moment, Bilbo narrates that ""a Hobbit's only true love is for food.""",,,,,,,,
Depth of Field," A faked long depth-of-field is accomplished by putting a prop ring the size of a plate in the foreground. That way, the One Ring lying in the snow appears in as much sharpness as the stuff in the background.",,,,,,,,
Digital Head Swap, One of the techniques used to create the proper scale for the Hobbits.,,,,,,,,
Disapproving Look," There's a two-fer early in the film as Gandalf is riding into the Shire with Frodo, who is explaining how Gandalf has come to be labeled a ""disturber of the peace"" while an old Hobbit sees them and gives Gandalf a very disapproving look. Then the children of the Shire see him and come running, Gandalf setting off some fireworks to delight them. The old Hobbit watches them cheering with a boisterous laugh, then stops as his wife comes out and give him her own disapproving look.",,,,,,,,
Distant Prologue," The movie starts with Galadriel narrating several crucial events leading up to the series. These include the creation of the Rings of Power (c. 4900 years ago), the War of the Last Alliance (c. 3000 years ago), and Bilbo Baggins taking the One Ring from Gollum (60 years ago). It then cuts to Bilbo's 111th birthday party and his departure for Rivendell, leaving Frodo and the One Ring behind, which happened a decade before the film proper begins.",,,,,,,,
Doing Research," After Bilbo leaves the Shire, Gandalf already has suspicions about the magical ring transmitted to Frodo. The Wizard is next seen doing historical research to learn more about the One Ring, notably the story of Isildur, to confirm those suspicions.",,,,,,,,
"Don't Ask, Just Run"," Gandalf says this when the Fellowship encounters the Balrog in Moria, sparked by ominous roaring and a creeping orange glow that makes the horde of goblins surrounding them run like hell. Gandalf's only explanation is ""This foe is beyond any of you. RUN!"" And, of course, just before he falls into the chasm: ""Fly, you fools!""",,,,,,,,
"Don't Touch It, You Idiot!"," While the gang is deep in the mines of Moria, Pippin the Hobbit innocently fiddles with an ancient suit of armour... Gandalf reacts appropriately.",,,,,,,,
Downer Ending," The Fellowship breaks in the end. Gandalf falls to his apparent doom, Boromir is killed, and Frodo and Sam have to journey into Mordor alone while Aragorn, Gimli and Legolas have to save Merry and Pippin from Saruman's Uruk-Hai.",,,,,,,,
Dramatic Necklace Removal," Isildur does this in order to get the One Ring off the chain around his neck and onto his finger when he was ambushed near the start of the movie. It's justified since he was under attack and therefore in a bit of a hurry, though there are the numerous other times somebody yanked the One Ring free of its chain.",,,,,,,,
Draw Aggro," Merry and Pippin call out to the Uruk Hai to distract them from Frodo's hiding place. Pippin: It's working! Merry: I know it's working, RUN!",,,,,,,,
Dug Too Deep," According to Saruman, the Dwarves of Moria did this, unleashing the Balrog .",,,,,,,,
The Dulcinea Effect, Gimli goes from describing Galadriel as a wicked sorceress to pledging himself as her Knight In Shining Armour within days of meeting her.,,,,,,,,
Dungeon Bypass," Averted; the Fellowship tries to go around Moria via a mountain pass, but Saruman awakens the mountain of Caradhras, causing an avalanche of rocks and snow that blocks their way, causing our heroes to have to backtrack and go through Moria anyway.",,,,,,,,
Ear Ache," After Merry and Pippin set off one of Gandalf's fireworks without his permission, he lifts them up by the pointy tips of their ears and glares down at them like they are misbehaving children.",,,,,,,,
Early-Bird Cameo," Inverted. Rohan appears briefly in the first book, establishing that the nation will enter the plot in the second. Played straight with Minas Tirith, Osgiliath and Minas Morgul. All three cities make brief appearances in this film during the ""Account of Isildur"" sequence (literally a split second in Osgiliath's case during the establishing shot of the Gondor-Mordor border) before becoming much more important in The Two Towers (albeit for Osgiliath, especially in the Extended Edition) and The Return of the King . Musical example with the Gondor Leitmotif in the case of the Extended Edition. The theme makes a brief early appearance during the Council of Elrond sequence (when Bormoir speaks of how Gondor and Denethor’s sacrifices have kept the West safe). It'll go on to reappear briefly in the Extended Editon of The Tower Towers (during the flashback to Bormoir and Faramir retaking Osgiliath) before finally taking center stage during The Return of the King .",,,,,,,,
Leitmotif,mple with the Gondor Leitmotif in the case of the Extended Edition. The theme makes a brief early appearance during the Council of Elrond sequence (when Bormoir speaks of how Gondor and Denethor’s sacrifices have kept the West safe). It'll go on to reappear briefly in the Extended Editon of The Tower Towers (during the flashback to Bormoir and Faramir retaking Osgiliath) before finally taking center stage during The Return of the King .,,,,,,,,
Early Installment Character-Design Difference, Downplayed. The designs of Gollum and the Eye of Sauron aren't quite as polished as in the next two films.,,,,,,,,
Establishing Character Moment," Quite a few. Sam telling Frodo the promise he made to Gandalf in the beginning. (""Don't you lose him, Samwise Gamgee!"") Merry and Pippin's mischief at Bilbo's birthday party. Boromir instantly suggesting the Ring be turned over to Gondor to use against Sauron. Legolas defending Aragorn against Boromir. Gimli grabbing an axe and attempting to destroy the Ring right at the council. Saruman chastising Gandalf for consorting with Hobbits. Lurtz chokes the first orc he sees within seconds of his birth. Gandalf arriving in Hobbiton for Bilbo's birthday party. All the children are excited to see him , while the adults look on disapprovingly (for the most part, one Hobbit laughs at a miniature fireworks display only to frown when his wife appears.) The first glimpse of the Lady Galadriel (other than the flash of her eyes that Frodo sees when he hears her voice in his mind) is her descending the stairs in Caras Galadhon with Celeborn in a blinding, majestic aura of white light. 'The Lady of Light', indeed!",,,,,,,,
All the children are excited to see him,"birthday party. All the children are excited to see him , while the adults look on disapprovingly (for the most part, one Hobbit laughs at a miniature fireworks display only to frown when his wife appears.)",,,,,,,,
Everybody Cries, The entire Fellowship cries after losing Gandalf.,,,,,,,,
Evil Sounds Deep," The Uruk-Hai captain Lurtz has a very deep voice, as do other orcs, when they're not given shrill, raspy voices.",,,,,,,,
Evil Tower of Ominousness," The (original) Dark Tower, Barad-dûr. It's actually depicted as under construction; the completed tower itself is first seen at the end of the film, from the Seat of Amon Hen.",,,,,,,,
Extreme Close-Up, Galadriel's intro scene frequently cuts right up to Galadriel's eyes and then cuts back to the eyes of a member of the Fellowship. This is a visual adaptation of the narration from the book which makes clear everyone in the Fellowship felt Galadriel's eyes piercing into their soul.,,,,,,,,
Fade to White," Used when Frodo first sees Arwen and later Elrond, when he's dying from the Morgul blade.",,,,,,,,
Fake Shemp," When Bilbo finds the Ring at the start of the movie, Gollum cries out, ""My precious!"". However, Andy Serkis was not on set that day, so Dominic Monaghan stood in for him.",,,,,,,,
Fanfare, The fellowship theme.,,,,,,,,
Fatal Fireworks," There's a comedic, non-fatal example: at Bilbo's birthday party, Pippin and Merry steal and launch one of Gandalf's firework rockets, ending up with an Ash Face .",,,,,,,,
Fear Is the Appropriate Response," Gandalf doesn't just inform the other characters that the Balrog is unstoppable. He calmly explains what a Balrog actually is while it's coming at them (it wasn't even in visual range), pauses to take a deep breath, looks shaken, and then shouts... ""RUN!"" and takes off ahead of the others, while they are still standing there looking at it. Making an about-face in the process.",,,,,,,,
Final Battle," The attack in Amon Hen, where Saruman's Uruk-Hai ambush the Fellowship of the Ring. Aragorn manages to behead the Uruk leader Lutz, Boromir dies, Frodo and Sam flee separately and Merry and Pippin are taken away by the Uruks, which breaks the Fellowship .",,,,,,,,
Final Speech," While Boromir had some last dying words in the book, they really spice it up in the film, especially with Boromir's last line to Aragorn: ""My brother, my captain, my king"".",,,,,,,,
Finger Extinguisher, Aragorn puts out a flame with his bare hand at the Prancing Pony when taking Frodo away for a private discussion.,,,,,,,,
Fire-Forged Friends," Gimli and Legolas probably count as Trope Codifiers. They openly hate each other at their first meeting (Gimli: ""Never trust an elf!""), but by the end of the final film, they are inseparable. (Excerpt from The Return of the King ) Gimli: Never thought I'd die fighting side by side with an Elf. Legolas: What about side by side with a friend? Gimli: ...aye. I could do that.",,,,,,,,
Flaming Sword," The Balrog has one of these, along with a fiery whip .",,,,,,,,
Foe-Tossing Charge," Sauron during the prologue, to get to Isildur. He enters the battlefield and starts smacking a half dozen soldiers forty feet into the air with each swing of his mace.",,,,,,,,
Forced Perspective," Used to great effect to help the average-height actors playing hobbits and dwarves seem to-scale with their man and elf co-stars. Used in reverse in one shot: While climbing Caradhras, Frodo falls and drops the Ring. There is a shot of the Ring lying in the snow in the foreground. The filmmakers used a larger model of the Ring, 6 inches in diameter, in this shot to make it seem closer while still being in-focus.",,,,,,,,
Foreshadowing," In an Extended-Version-only scene, Frodo and Sam see a group of Wood-Elves on their way to the Grey Havens while they're leaving the Shire. The final film ends with Frodo going to the Grey Havens and leaving Middle-earth with the rest of the elves . As Gandalf tries to lead the Fellowship through the Pass of Caradhras, Boromir picks up the One Ring after Frodo stumbles down hill and ""drops"" it. Boromir returns it after some hesitation and obsessing over it. Later, Boromir tries to take the Ring forcefully, having gotten a taste of its influence before. Boromir narrowly avoids being hit by arrows in Moria. On a related note, Isildur is killed by three arrows - the same amount as Boromir. Aragorn realizes that they're being followed by Gollum, but says that he's ""too good a waterman"" to catch. In The Lord of the Rings: The Return of the King we see a flashback of Smeagol and Deagol pole-fishing from a boat, and Deagol proves to be a good swimmer. This bit in the Extended Edition also explicitly establishes that Gollum made out of Moria and is still on the Fellowship’s tail. This sets up Gollum continuing to follow Frodo and Sam once they split off from the Fellowship and finally making his move at the beginning of the next film (something was only implied in the Theatrical Edition).",,,,,,,,
The Lord of the Rings: The Return of the King," Gollum, but says that he's ""too good a waterman"" to catch. In The Lord of the Rings: The Return of the King we see a flashback of Smeagol and Deagol pole-fishing from a boat, and Deagol proves to be a good swimmer.",,,,,,,,
Forging Scene," The forging of the One Ring by Sauron is shown during the film's prologue. There's also the mass-production of the Uruk-hai's ugly but effective weapons and armor emphasizes the Industrialized Evil of Isengard. The reforging of Narsil into Andúril is much more dramatic, and features Arwen reciting parts of the poem that serves as Aragorn's Trust Password in the books.",,,,,,,,
Industrialized Evil,-production of the Uruk-hai's ugly but effective weapons and armor emphasizes the Industrialized Evil of Isengard.,,,,,,,,
Trust Password," Narsil into Andúril is much more dramatic, and features Arwen reciting parts of the poem that serves as Aragorn's Trust Password in the books.",,,,,,,,
Forgot to Mind Their Head," This was a hazard both in and out of universe: During the scene where Gandalf visits Bilbo in his hobbit hole, Gandalf, stooping, accidentally backs into a chandelier (as part of the script). His actor Ian McKellen then promptly turns and accidentally smacks his head on the roof, an (unscripted) accident so funny that they left it in . invoked In the gag reel, this happens also to the crew. Everyone's sitting inside the hobbit hole listening to directions, then when the meeting ends they all stand up and hit their heads on the roof. Then everyone falls to the floor.",,,,,,,,
Ian McKellen,"ne where Gandalf visits Bilbo in his hobbit hole, Gandalf, stooping, accidentally backs into a chandelier (as part of the script). His actor Ian McKellen then promptly turns and accidentally smacks his head on the roof, an (unscripted) accident so funny that they left it in . invoked",,,,,,,,
Freeze-Frame Bonus," Peter Jackson points out on the DVD Commentary that if you’re paying attention during the wide shots for Bilbo’s birthday party speech, you’ll realize that his birthday cake is melting. This was due to the polystyrene catching fire from the 111 candles (hence the smoke and glow on Ian Holm’s face). But because Holm was on a roll, they kept shooting and cropped out the cake in post-production.",,,,,,,,
Friends All Along," Aragorn is hurrying to find a herb to heal Frodo when someone sneaks up behind him and holds a blade to his throat. Said person turns out to be Arwen, teasing him.",,,,,,,,
Frying Pan of Doom, Sam uses his cooking gear to whack some goblins in Moria. Sam: I think I'm getting the hang of this.,,,,,,,,
Full-Contact Magic, Gandalf and Saruman's staff-fight in Saruman's chambers involves them striking the air with their staves and generating telekinetic waves against the opponent.,,,,,,,,
Ghostly Glide, The Nazgûl move like ghosts when they invade the Prancing Pony.,,,,,,,,
Giant Squid," The Watcher in the Water is decidedly squid-like, with bits of octopus thrown in for good measure. In the books the description is a bit more vague but still retains most of the Giant Squid properties.",,,,,,,,
Giant Wall of Watery Doom," When Arwen conjures up the Bruinen river against the Black Riders (invoking a Mass ""Oh, Crap!"" out of them, but they can't outrun it). For added awesomeness, the waves are horse-shaped.",,,,,,,,
Gloved Fist of Doom, Boromir does this at least once while contemplating the power of the One Ring.,,,,,,,,
God Save Us from the Queen!," ""In place of a Dark Lord you would have a QUEEN! Not dark but beautiful and terrible as the dawn! Treacherous as the sea ! Stronger than the foundations of the Earth! All shall love me, and despair !""",,,,,,,,
Go Through Me," During the scene on Weathertop, the Ringwraiths casually fling aside the other hobbits trying to protect Frodo.",,,,,,,,
Great Offscreen War," The movie begins with Galadriel recounting the story of the last war with Sauron, several thousand years prior. We only see the end of the final battle.",,,,,,,,
Grief Song, Elves sing a tearjerking lament for Gandalf.,,,,,,,,
Hammer Hilt," When Aragorn faces down the entire horde of Uruk-Hai, he starts off the fight by following his first sword swing by smashing the crossguard of his sword into one Uruk's face.",,,,,,,,
Ham-to-Ham Combat," There's the massive ham-off between those two old thesps, Christopher Lee and Ian McKellen as Saruman and Gandalf. ""You have chosen the way of pain!"" indeed. No piece of the scenery is left unchewed.",,,,,,,,
Happily Ever Before," The book ends with Boromir trying to steal the Ring, the departure of Frodo and Sam for Mordor and the capture of Merry and Pippin by the Uruk-hai. The film inverts it by including the first chapter of The Two Towers , which has the redemption and death of Boromir and the Three Hunters giving chase to the hobbits' captors, arguably ending on a more positive, hopeful note that comes afterwards .",,,,,,,,
Heroic Second Wind," Subverted. Boromir takes an arrow, goes down... gets back up and keeps fighting. Four times before he can no longer get up again, taking out at least two orcs each time.",,,,,,,,
Hoist by His Own Petard, The axe-wielding Uruk-hai takes his own axe in his back from Boromir.,,,,,,,,
Hollywood Drowning, Averted. Sam's near-drowning occurs without much flailing or noise. Frodo knows he's drowning because he knows Sam can't swim.,,,,,,,,
Homage Shot," Peter Jackson shot one bit at Bilbo's birthday party (""Proudfeet!"") as an exact copy of a shot in Ralph Bakshi 's animated Lord of the Rings . Jackson even helpfully points this out in the commentary. A circle-round shot of the four hobbits at Weathertop is also lifted from the original, although the camera moves much faster and Aragorn is absent. Same goes for the four hobbits hiding under a root by the wayside with the Nazgûl leaning in above them. Not exactly an homage shot, but the Nazgûl attacking the Hobbits' room at the Prancing Pony was drawn from Bakshi's film. In the books, it's explicitly stated by Aragorn that they would not have openly attacked the inn in this manner, and that their assailants were instead Men of Bree under their influence.",,,,,,,,
Peter Jackson,"hot one bit at Bilbo's birthday party (""Proudfeet!"") as an exact copy of a shot in Ralph Bakshi 's animated Lord of the Rings . Jackson even helpfully points this out in the commentary. A circle-round shot of the four hobbits at Weathertop is also lifted from the original, although the camera moves much faster and Aragorn is absent. Same goes for the four hobbits hiding under a root by the wayside with the Nazgûl leaning in above them.",,,,,,,,
Hope Spot," The film begins with one. During the battle between the Last Alliance of Elves and Man against Sauron's forces, the Alliance nearly succeeds in driving back the forces of Mordor... only for Sauron himself to join the battle and singlehandedly turn the tide back in his favor. But ironically, this also counts as a Hope Spot for Sauron too. Right as he's crushing the Alliance and on the cusp of total victory, Isildur severs the ring from his hand, separating him from his source of power and destroying his physical body. Gandalf gets one In-Universe when he uses the information he obtained in Minas Tirith to test the One Ring. The Ring doesn't react to fire and for a moment, Gandalf's quietly relieved he was wrong and this isn't the evil artifact he'd feared it was... and then Frodo spots the emerging Black Speech... Probably the cruelest one in film history is when Gandalf sends the Balrog off the bridge and begins turning back... only for the tips of its whip to catch Gandalf by the foot and leave him dangling off the side of the bridge.",,,,,,,,
Hope Spot,"gins with one. During the battle between the Last Alliance of Elves and Man against Sauron's forces, the Alliance nearly succeeds in driving back the forces of Mordor... only for Sauron himself to join the battle and singlehandedly turn the tide back in his favor. But ironically, this also counts as a Hope Spot for Sauron too. Right as he's crushing the Alliance and on the cusp of total victory, Isildur severs the ring from his hand, separating him from his source of power and destroying his physical body.",,,,,,,,
Horns of Villainy," The Balrog wasn't clearly described in the novels, but it's given large ram-like horns, giving it a beast-like appearance.",,,,,,,,
Horrifying the Horror," An army of goblins surround the Fellowship, only to immediately scurry off in fear after hearing the roar of the Balrog.",,,,,,,,
Hostile Weather," The snowstorm on Caradhras. The movie clearly shows that Saruman is behind it too, while in the book it's left vague.",,,,,,,,
How Much Did You Hear?," Gandalf catches Sam outside the Baggins home, demands to know how much Sam heard and then has Sam accompany Frodo on his journey. Gandalf: What did you hear?! Speak! Sam: N-nothing important! That is, I heard a good deal about a ring and a Dark Lord, and something about the end of the world...",,,,,,,,
Human Traffic Jam, Happens when the Hobbits are running away from Farmer Maggot; doubles as a Cliff Stack .,,,,,,,,
I Fight for the Strongest Side!," One of Saruman 's reasonings for betraying the Free Peoples and siding with Sauron is that at his core, he's always believed that the battle between good and evil can only be won through a matter of power (as noted by Gandalf in The Hobbit: An Unexpected Journey ) — and he's seen and learned enough about Sauron's power to believe that he can't be stopped and the only options available are to either join him or die.",,,,,,,,
Implausible Deniability," When Gandalf catches Sam eavesdropping at Bag End, the latter insists he was just simply cutting the grass, that’s all. That explanation might have worked…if it wasn’t currently the middle of the night. Gandalf naturally lampshades this.",,,,,,,,
Improbable Aiming Skills," In addition to Legolas, who, as an elf, naturally demonstrates absurd skill, there's the opening battle of Mount Doom, where human archers shoot down orcs on the mountainside a good quarter mile away (long range for a modern infantry rifle, much less a bow). Perhaps justified if one accepts that it's Galadriel's recounting of events she didn't actually see but was simply told of.",,,,,,,,
Inevitable Waterfall," This scene appears to pop up, but it's okay, they're just banking at The Gates of Argonath . When Frodo and Samwise paddle across the lake, there doesn't even seem to be a current moving toward the falls!",,,,,,,,
Instantly Proven Wrong," As the fellowship is travelling through forbidden Elven woods, Gimli declares that he won't be caught easily, because he has ""the eyes of a hawk and the ears of a fox."" A split second later, he sees elves pointing drawn bows at him less than half a meter away, and Haldir claims that he was breathing so loudly that they could have shot him in the dark. Gimli: Here's one dwarf they won't ensnare so easily! I've got the eyes of a hawk and the ears of a fox. [cue elvish arrows drawn at Gimli's head at point-blank range]",,,,,,,,
Inverse Dialogue/Death Rule," Boromir takes forever to be killed (arrow after arrow, and overcranked as well), complete with a speech to Aragorn after the latter just had a big duel with the chief Uruk-Hai.",,,,,,,,
Ironic Echo," Gandalf finds a record of Isildur's journal, accounting the finding of the One Ring. Isildur: I will risk no harm to the Ring. It is precious to me. Averted in some dubs where they change Gollum's my precious but miss this echo .",,,,,,,,
miss this echo,dubs where they change Gollum's my precious but miss this echo .,,,,,,,,
It Has Been an Honour," Boromir's last words to Aragorn. Boromir: I would have followed you, my brother... my captain... my king .",,,,,,,,
It May Help You on Your Quest," Galadriel's gifts. All of them. Even moreso in the book, where she gives Sam a box of dirt with a mallorn nut in it. It helps.",,,,,,,,
It Was a Gift," Mostly skips over Galadriel's gift giving, only mentioning her gift to Frodo. But in a deleted scene Gimli talks about his gift — Galadriel wasn't sure what to give him, so he asked for a single strand of hair from her head, and she gave him three. Legolas's surprised smile, and Gimli's satisfied tone, make this a rather heartwarming scene — especially if the viewer is familiar with the origin of the Silmarils . Invoked when Aragorn — prior to setting out with the Fellowship — attempts to return the Evenstar pendant which Arwen had given him as a sign of her intention to choose a mortal life with him. She's hurt by the action and tells him, "" It was a gift. Keep it.""",,,,,,,,
the origin of the Silmarils," gift giving, only mentioning her gift to Frodo. But in a deleted scene Gimli talks about his gift — Galadriel wasn't sure what to give him, so he asked for a single strand of hair from her head, and she gave him three. Legolas's surprised smile, and Gimli's satisfied tone, make this a rather heartwarming scene — especially if the viewer is familiar with the origin of the Silmarils .",,,,,,,,
It was a gift.,"gorn — prior to setting out with the Fellowship — attempts to return the Evenstar pendant which Arwen had given him as a sign of her intention to choose a mortal life with him. She's hurt by the action and tells him, "" It was a gift. Keep it.""",,,,,,,,
